{
  "schema_version":"1.0","market":"iran_stock","symbol":"FMLI","core_fundamental_score":84,"classification":"very_strong","last_reviewed_at":"2026-09-25","previous_score":81,"change":3,"change_reason":"Improved quarterly profitability","change_date":"2026-09-25","evidence":[{"type":"financial_report","source":"Codal","date":"2026-09-25"}]
}